{
  "id": "architecture-decision-records",
  "name": "Architecture Decision Records",
  "category": "development",
  "icon": "<svg xmlns=\"http://www.w3.org/2000/svg\" width=\"24\" height=\"24\" viewBox=\"0 0 24 24\" fill=\"none\"><path d=\"M7 3h7l4 4v14H7z\" stroke=\"#2563EB\" stroke-width=\"1.7\" stroke-linecap=\"round\" stroke-linejoin=\"round\"/><path d=\"M14 3v4h4M10 12h5M10 16h5\" stroke=\"#2563EB\" stroke-width=\"1.7\" stroke-linecap=\"round\" stroke-linejoin=\"round\"/></svg>",
  "tags": [
    "adr",
    "architecture",
    "documentation",
    "decisions"
  ],
  "i18n": {
    "zh-CN": {
      "name": "架构决策记录",
      "shortDesc": "把技术决策沉淀为编号 ADR 文档并维护索引。需对项目目录有写权限。"
    },
    "en-US": {
      "name": "Architecture Decision Records",
      "shortDesc": "Capture technical decisions as numbered ADRs and maintain an index. Needs write access to the project directory."
    }
  },
  "maintainer": {
    "name": "affaan-m",
    "verified": false,
    "account": "affaan-m",
    "url": "https://github.com/affaan-m/ECC"
  },
  "stewardship": "community",
  "license": "MIT",
  "redistribution": "allowed",
  "source": {
    "kind": "git",
    "repoUrl": "https://github.com/affaan-m/ECC.git",
    "repoBranch": "main",
    "ref": "ef648e01899ba3e8dc6371642deaaf64b4477775",
    "path": "skills/architecture-decision-records"
  }
}
