{
  "id": "mt-paotui-for-client",
  "name": "Meituan Paotui Client",
  "category": "business",
  "icon": "<svg xmlns=\"http://www.w3.org/2000/svg\" width=\"24\" height=\"24\" viewBox=\"0 0 24 24\" fill=\"none\"><path d=\"M4 7h10v9H4zM14 10h3l3 3v3h-6z\" stroke=\"#2563EB\" stroke-width=\"1.7\" stroke-linejoin=\"round\"/><circle cx=\"8\" cy=\"18\" r=\"1.5\" fill=\"#2563EB\"/><circle cx=\"17\" cy=\"18\" r=\"1.5\" fill=\"#2563EB\"/></svg>",
  "tags": [
    "meituan"
  ],
  "i18n": {
    "zh-CN": {
      "name": "美团跑腿下单助手",
      "shortDesc": "美团跑腿下单助手：帮取送、帮忙（取号/搬装）、帮买全流程下单，含地址搜索与两步费用确认。需美团账号与上游授权工具；真实订单和配送费用须由用户确认。"
    },
    "en-US": {
      "name": "Meituan Paotui Client",
      "shortDesc": "Meituan Paotui ordering assistant for pickup-delivery, errands and shopping, with address search and two-step cost confirmation. Requires a Meituan account and the upstream authorization tool; real orders and delivery charges require user confirmation."
    }
  },
  "maintainer": {
    "name": "meituan",
    "verified": false,
    "account": "meituan",
    "url": "https://github.com/meituan/MT-Paotui-For-Client"
  },
  "stewardship": "pointer",
  "license": "not-declared",
  "redistribution": "source-pointer-only",
  "source": {
    "kind": "git",
    "repoUrl": "https://github.com/meituan/MT-Paotui-For-Client.git",
    "repoBranch": "main",
    "ref": "05ead232ae2b94b9b55b2a1e126e039a1cb6db00"
  }
}
