{
  "id": "humanizer-zh",
  "name": "Humanizer 中文版",
  "category": "creative",
  "icon": "<svg xmlns=\"http://www.w3.org/2000/svg\" width=\"24\" height=\"24\" viewBox=\"0 0 24 24\" fill=\"none\"><path d=\"M3.5 6h7M3.5 11h5M3.5 16h8\" stroke=\"#2563EB\" stroke-width=\"1.7\" stroke-linecap=\"round\"/><path d=\"m19.4 5.6-6 6-2.4.5.5-2.4 6-6a1.3 1.3 0 0 1 1.9 1.9Z\" stroke=\"#2563EB\" stroke-width=\"1.6\" stroke-linejoin=\"round\"/><path d=\"M15.5 17.5h5\" stroke=\"#2563EB\" stroke-width=\"1.7\" stroke-linecap=\"round\"/><path d=\"M18 15.5v4\" stroke=\"#2563EB\" stroke-width=\"1.7\" stroke-linecap=\"round\"/></svg>",
  "tags": ["writing", "editing", "ai-detection", "humanize", "chinese"],
  "i18n": {
    "zh-CN": {
      "name": "Humanizer 中文版",
      "shortDesc": "Humanizer 的汉化版本，按中文写作习惯去除 AI 生成痕迹，附核心规则、快速检查清单与质量评分，适配 Claude Code、Codex 等"
    },
    "en-US": {
      "name": "Humanizer (Chinese)",
      "shortDesc": "Chinese localization of Humanizer that removes AI writing patterns following Chinese prose conventions, with core rules, a quick checklist and quality scoring for Claude Code and Codex"
    }
  },
  "maintainer": {
    "name": "歸藏 (op7418)",
    "verified": false,
    "account": "op7418",
    "url": "https://github.com/op7418/Humanizer-zh"
  },
  "stewardship": "community",
  "license": "MIT",
  "redistribution": "allowed",
  "source": {
    "kind": "git",
    "repoUrl": "https://github.com/op7418/Humanizer-zh.git",
    "repoBranch": "main",
    "ref": "f4518a8eab97b8bfebc66a89d34320a89bef6930"
  }
}
