{
  "id": "himalaya",
  "name": "Himalaya",
  "category": "communication",
  "icon": "<svg xmlns=\"http://www.w3.org/2000/svg\" width=\"24\" height=\"24\" viewBox=\"0 0 24 24\" fill=\"none\"><rect x=\"3\" y=\"6\" width=\"18\" height=\"12\" rx=\"2\" stroke=\"#2563EB\" stroke-width=\"1.7\" stroke-linecap=\"round\" stroke-linejoin=\"round\"/><path d=\"M3 8l9 6 9-6\" stroke=\"#2563EB\" stroke-width=\"1.7\" stroke-linecap=\"round\" stroke-linejoin=\"round\"/></svg>",
  "tags": [
    "email",
    "imap",
    "smtp",
    "cli"
  ],
  "i18n": {
    "zh-CN": {
      "name": "命令行邮件客户端",
      "shortDesc": "用 himalaya 通过 IMAP/SMTP 收发整理邮件。需 himalaya 命令行、邮箱 IMAP/SMTP 凭据（如应用专用密码）及 ~/.config/himalaya/config.toml。"
    },
    "en-US": {
      "name": "Himalaya",
      "shortDesc": "Send, receive and organize email over IMAP/SMTP with himalaya. Requires the himalaya CLI, IMAP/SMTP credentials (e.g. an app password) and ~/.config/himalaya/config.toml."
    }
  },
  "maintainer": {
    "name": "openclaw",
    "verified": false,
    "account": "openclaw",
    "url": "https://github.com/openclaw/openclaw"
  },
  "stewardship": "community",
  "license": "MIT",
  "redistribution": "allowed",
  "source": {
    "kind": "git",
    "repoUrl": "https://github.com/openclaw/openclaw.git",
    "repoBranch": "main",
    "ref": "9adda02605eca1f45eb10f009dd4c3e575713032",
    "path": "skills/himalaya"
  }
}
