{
  "id": "logistics-exception-management",
  "name": "Logistics Exception Management",
  "category": "business",
  "icon": "<svg xmlns=\"http://www.w3.org/2000/svg\" width=\"24\" height=\"24\" viewBox=\"0 0 24 24\" fill=\"none\"><path d=\"M12 3l8 4.5v9L12 21l-8-4.5v-9z\" stroke=\"#2563EB\" stroke-width=\"1.7\" stroke-linecap=\"round\" stroke-linejoin=\"round\"/><path d=\"M4 7.5L12 12l8-4.5M12 12v9\" stroke=\"#2563EB\" stroke-width=\"1.7\" stroke-linecap=\"round\" stroke-linejoin=\"round\"/></svg>",
  "tags": [
    "logistics",
    "claims",
    "carrier",
    "operations"
  ],
  "i18n": {
    "zh-CN": {
      "name": "物流异常处理",
      "shortDesc": "货运延误、破损、丢失与承运商争议的处理框架。需提供运单、签收单、照片等材料。"
    },
    "en-US": {
      "name": "Logistics Exception Management",
      "shortDesc": "A framework for freight delays, damage, loss and carrier disputes. Needs waybills, delivery receipts and photos from you."
    }
  },
  "maintainer": {
    "name": "affaan-m",
    "verified": false,
    "account": "affaan-m",
    "url": "https://github.com/affaan-m/ECC"
  },
  "stewardship": "community",
  "license": "Apache-2.0",
  "redistribution": "allowed",
  "source": {
    "kind": "git",
    "repoUrl": "https://github.com/affaan-m/ECC.git",
    "repoBranch": "main",
    "ref": "ef648e01899ba3e8dc6371642deaaf64b4477775",
    "path": "skills/logistics-exception-management"
  }
}
