{
  "id": "article-writing",
  "name": "Article Writing",
  "category": "creative",
  "icon": "<svg xmlns=\"http://www.w3.org/2000/svg\" width=\"24\" height=\"24\" viewBox=\"0 0 24 24\" fill=\"none\"><path d=\"M7 3h7l4 4v14H7z\" stroke=\"#2563EB\" stroke-width=\"1.7\" stroke-linecap=\"round\" stroke-linejoin=\"round\"/><path d=\"M14 3v4h4M10 12h5M10 16h5\" stroke=\"#2563EB\" stroke-width=\"1.7\" stroke-linecap=\"round\" stroke-linejoin=\"round\"/></svg>",
  "tags": [
    "writing",
    "article",
    "long-form",
    "voice"
  ],
  "i18n": {
    "zh-CN": {
      "name": "长文写作",
      "shortDesc": "按指定文风写出有观点、有证据的长文。文风匹配依赖同仓库的 brand-voice 技能（本次未收录）。"
    },
    "en-US": {
      "name": "Article Writing",
      "shortDesc": "Write opinionated, evidence-backed long-form articles in a specified voice. Voice matching relies on the separate brand-voice skill from the same repository."
    }
  },
  "maintainer": {
    "name": "affaan-m",
    "verified": false,
    "account": "affaan-m",
    "url": "https://github.com/affaan-m/ECC"
  },
  "stewardship": "community",
  "license": "MIT",
  "redistribution": "allowed",
  "source": {
    "kind": "git",
    "repoUrl": "https://github.com/affaan-m/ECC.git",
    "repoBranch": "main",
    "ref": "ef648e01899ba3e8dc6371642deaaf64b4477775",
    "path": "skills/article-writing"
  }
}
